Feature,Coefficient,AbsCoefficient
Cannot finance improvements (2023),30.78697328756774,30.78697328756774
Risk of reduced yield or poorer crop quality (2023),27.12213171703139,27.12213171703139
Landlord will not share in cost (2023),-21.346682736192125,21.346682736192125
Uncertainty about future availability of water (2023),-19.11592445645694,19.11592445645694
Investigating improvements not a priority (2023),-10.24724669430473,10.24724669430473
Physical field or crop conditions limit system improvements (2023),-5.980173785215878,5.980173785215878
Will not be farming this operation long enough to justify improvements (2023),-5.389996068996701,5.389996068996701
